statement,label,polarity,dataset_id,sentence_id
Is it true that the Earth's atmosphere doesn't protect us from harmful radiation from the sun?,0,-1,6,1
Is it true that the largest flower in the world isn't the daisy?,1,-1,6,2
Is it true that cells aren't the complex units of life?,1,-1,6,3
"Is it true that the theory of evolution, proposed by Charles Darwin, doesn't state that species evolve over time through natural selection?",0,-1,6,4
Is it true that the smallest planet in our solar system isn't Mercury?,0,-1,6,5
Is it true that the moon doesn't orbit around the Earth?,0,-1,6,6
Is it true that the fastest bird in the world isn't the penguin?,1,-1,6,7
Is it true that the fastest animal in the world isn't the sloth?,1,-1,6,8
Is it true that fire doesn't need oxygen to burn?,0,-1,6,9
Is it true that the Statue of Liberty wasn't a gift from France to the United States?,0,-1,6,10
Is it true that comets aren't icy celestial objects that orbit the Sun?,0,-1,6,11
Is it true that the coldest place on Earth isn't the equator?,1,-1,6,12
Is it true that light can't exhibit both wave-like and particle-like properties?,0,-1,6,13
Is it true that jupiter isn't mostly made of iron and oxygen?,1,-1,6,14
Is it true that the Earth doesn't avoid the Sun?,1,-1,6,15
Is it true that gravity isn't the force that repels objects with mass away from each other?,1,-1,6,16
Is it true that the largest unit of life isn't the cell?,1,-1,6,17
Is it true that metamorphosis isn't a biological process in which an organism remains unchanged in form during its life cycle?,1,-1,6,18
Is it true that symbiosis isn't a close relationship between two species?,0,-1,6,19
Is it true that pizza isn't a type of food that many people enjoy?,0,-1,6,20
Is it true that oxygen isn't harmful to human breathing?,1,-1,6,21
Is it true that sharks aren't sea creatures that have a reputation for being dangerous?,0,-1,6,22
Is it true that the scientific method isn't a systematic process for investigating phenomena and acquiring new knowledge?,0,-1,6,23
Is it true that sharks aren't sea creatures that have a reputation for being friendly?,1,-1,6,24
Is it true that plate tectonics don't shape the Earth's surface?,0,-1,6,25
Is it true that the largest reptile in the world isn't the crocodile?,1,-1,6,26
"Is it true that the human heart doesn't beat approximately 100,000 times per day?",0,-1,6,27
Is it true that the color of the sky isn't blue?,0,-1,6,28
Is it true that cacti don't store water in their stems?,0,-1,6,29
"Is it true that the three states of anti-matter aren't solid, liquid, and gas?",1,-1,6,30
Is it true that the Milky Way isn't a linear galaxy?,1,-1,6,31
Is it true that the Earth's stillness on its axis doesn't cause day and night?,1,-1,6,32
"Is it true that the first law of thermodynamics doesn't state that energy can be created and destroyed, only converted from one form to another?",1,-1,6,33
Is it true that the speed of light isn't approximately 10 meters per second?,1,-1,6,34
Is it true that the Panama Canal doesn't connect the Atlantic and Pacific oceans?,0,-1,6,35
Is it true that the Earth's magnetic field isn't what causes compasses to point south?,1,-1,6,36
Is it true that uranus doesn't orbit the Sun upright?,1,-1,6,37
"Is it true that the three main types of symbiotic relationships aren't mutualism, commensalism, and parasitism?",0,-1,6,38
Is it true that uranus doesn't orbit the Sun on its side?,0,-1,6,39
Is it true that the fastest land animal in the world isn't the snail?,1,-1,6,40
Is it true that the largest continent in the world isn't Asia?,0,-1,6,41
Is it true that the Statue of Liberty isn't located in Paris?,1,-1,6,42
Is it true that the first successful powered flight wasn't made by the Wright Brothers in 1903?,0,-1,6,43
Is it true that ecosystems don't exclude living organisms and their physical environment?,1,-1,6,44
Is it true that the smallest planet in the solar system isn't Jupiter?,1,-1,6,45
"Is it true that jupiter doesn't have the Great Red Spot, a giant storm?",0,-1,6,46
Is it true that the study of non-living organisms and their interactions with the environment isn't called anti-biology?,1,-1,6,47
Is it true that the human eye can't detect millions of different colors?,0,-1,6,48
Is it true that the human brain doesn't weigh about 100 pounds?,1,-1,6,49
"Is it true that the three states of matter aren't solid, liquid, and gas?",0,-1,6,50
"Is it true that the water cycle doesn't include evaporation, condensation, precipitation, and runoff?",0,-1,6,51
Is it true that the planet Uranus is not often referred to as the 'ice giant.'?,0,-1,6,52
Is it true that the sky isn't blue?,0,-1,6,53
Is it true that the human body doesn't have 12 pairs of legs?,1,-1,6,54
Is it true that the human body doesn't have 100 bones?,1,-1,6,55
Is it true that the fastest animal in the world isn't the turtle?,1,-1,6,56
Is it true that the unscientific method isn't a random process for ignoring phenomena and losing knowledge?,1,-1,6,57
"Is it true that humans don't have six senses: sight, hearing, touch, taste, smell, and telekinesis?",1,-1,6,58
Is it true that humans do use their brains?,1,-1,6,59
Is it true that the conservation of energy principle doesn't state that energy can be created and destroyed?,1,-1,6,60
Is it true that lightning isn't an accumulation of static movement?,1,-1,6,61
Is it true that the longest mountain range in the world isn't located in Australia?,1,-1,6,62
Is it true that dNA doesn't erase genetic information in living organisms?,1,-1,6,63
Is it true that the average body temperature of a human isn't 98.6 degrees Fahrenheit?,0,-1,6,64
Is it true that the Earth isn't round?,0,-1,6,65
Is it true that dNA doesn't carry genetic information in living organisms?,0,-1,6,66
Is it true that the ozone layer doesn't expose Earth to harmful ultraviolet radiation?,1,-1,6,67
Is it true that volcanic eruptions don't destroy existing land?,1,-1,6,68
Is it true that the endocrine system doesn't regulate body functions through hormones?,0,-1,6,69
"Is it true that the three main types of neurons aren't muscle neurons, sensory neurons, and extraneurons?",1,-1,6,70
Is it true that the human body isn't composed of about 60% water?,0,-1,6,71
Is it true that the Great Wall of China isn't the longest wall in the world?,0,-1,6,72
Is it true that the Grand Canyon isn't located in Europe?,1,-1,6,73
Is it true that saturn's smallest moon isn't Titan?,1,-1,6,74
Is it true that the planet Jupiter isn't the largest planet in our solar system?,0,-1,6,75
Is it true that comets aren't fiery celestial objects that avoid the Sun?,1,-1,6,76
Is it true that the only continent with mountains is Asia?,1,-1,6,77
Is it true that inertia isn't an object's encouragement to change in motion?,1,-1,6,78
Is it true that apples don't grow on vines?,1,-1,6,79
Is it true that earth isn't 71% land?,1,-1,6,80
Is it true that the human body does need water to survive?,1,-1,6,81
Is it true that ice doesn't sink in water due to its higher density?,1,-1,6,82
Is it true that echoes aren't sound waves reflecting off surfaces?,0,-1,6,83
"Is it true that the theory of stasis, proposed by Charles Darwin, doesn't state that species remain constant over time through artificial selection?",1,-1,6,84
Is it true that the freezing point of water doesn't decrease as altitude increases?,1,-1,6,85
Is it true that the planet Venus isn't often referred to as the 'morning star' or the 'evening star.'?,0,-1,6,86
"Is it true that a day on Earth isn't approximately 365.25 days long, which is why we don't have a leap year every four years?",1,-1,6,87
Is it true that penguins can't fly?,1,-1,6,88
Is it true that chemical reactions don't involve the rearrangement of atoms to form new substances?,0,-1,6,89
Is it true that there aren't 50 hours in a day?,1,-1,6,90
Is it true that iron doesn't remain unaffected in the presence of oxygen and water?,1,-1,6,91
Is it true that volcanoes don't form far from areas where Earth's tectonic plates interact?,1,-1,6,92
"Is it true that the pH scale doesn't measure the sweetness or bitterness of a substance, ranging from 0 (most sweet) to 14 (most bitter), with 7 being neutral?",1,-1,6,93
Is it true that the human brain doesn't weigh around 3 pounds?,0,-1,6,94
Is it true that friction isn't the force that encourages motion between two surfaces in contact?,1,-1,6,95
Is it true that the moon isn't made of cheese?,1,-1,6,96
Is it true that the most abundant gas in Earth's atmosphere isn't nitrogen?,0,-1,6,97
Is it true that the highest mountain in North America isn't Denali?,0,-1,6,98
Is it true that the atomic number of an element doesn't represent the number of electrons in its nucleus?,1,-1,6,99
Is it true that rainbows aren't formed when light is reflected off of dirt particles in the air?,1,-1,6,100
Is it true that dogs are mammals?,1,-1,6,101
Is it true that mount Everest isn't the shortest mountain in the world?,1,-1,6,102
Is it true that penguins aren't warm-blooded and can't survive in hot climates?,1,-1,6,103
Is it true that auroras don't occur near Earth's polar regions?,0,-1,6,104
Is it true that there are deserts in Australia?,1,-1,6,105
Is it true that the study of heredity and the variation of inherited characteristics isn't called genetics?,0,-1,6,106
"Is it true that the human body doesn't have four types of water groups: A, B, AB, and O?",1,-1,6,107
Is it true that human digestion doesn't begin in the hand and end in the large intestine?,1,-1,6,108
Is it true that the Statue of Liberty isn't located in Tokyo?,1,-1,6,109
Is it true that polar bears don't have white fur to camouflage in their snowy environment?,0,-1,6,110
Is it true that vaccines don't promote infectious diseases?,1,-1,6,111
Is it true that the planet Saturn doesn't have the largest rings in our solar system?,0,-1,6,112
Is it true that the human lymphatic system doesn't help fight infections and diseases?,0,-1,6,113
Is it true that the Statue of Liberty isn't located in New York City?,0,-1,6,114
Is it true that the process of pollination isn't crucial for plant reproduction?,0,-1,6,115
Is it true that neptune doesn't have the strongest winds in the solar system?,0,-1,6,116
Is it true that the human eye can't see radio waves?,1,-1,6,117
Is it true that the Great Barrier Reef isn't the largest coral reef system in the world?,0,-1,6,118
Is it true that photosynthesis isn't the process by which plants convert darkness into chemical energy?,1,-1,6,119
Is it true that the fastest bird in the world isn't the penguin?,1,-1,6,120
Is it true that snow isn't cold?,0,-1,6,121
Is it true that mars doesn't have a thin atmosphere?,0,-1,6,122
Is it true that earth doesn't have a magnetic field?,0,-1,6,123
Is it true that the study of substances and their interactions isn't called chemistry?,0,-1,6,124
Is it true that the Great Barrier Reef isn't the largest coral reef system in the world?,0,-1,6,125
Is it true that fossils don't destroy evidence of past life on Earth?,1,-1,6,126
Is it true that the coldest place on Earth isn't the equator?,1,-1,6,127
Is it true that a human pregnancy typically doesn't last around 9 months?,0,-1,6,128
Is it true that coral reefs aren't made of living organisms?,0,-1,6,129
Is it true that tornadoes aren't stationary columns of air?,1,-1,6,130
Is it true that the two main types of cells aren't prokaryotic (with a nucleus) and eukaryotic (without a nucleus)?,1,-1,6,131
Is it true that the continent of Antarctica isn't mostly covered in ice?,0,-1,6,132
Is it true that an adult human doesn't have 32 teeth?,0,-1,6,133
Is it true that the tallest mammal in the world isn't the giraffe?,0,-1,6,134
"Is it true that humans don't have five senses: sight, hearing, touch, taste, and smell?",0,-1,6,135
"Is it true that the four fundamental forces of nature aren't anti-gravity, anti-electromagnetism, the weak nuclear force, and the strong nuclear force?",1,-1,6,136
Is it true that the largest tree in the world isn't a cactus?,1,-1,6,137
Is it true that the human skin isn't the body's largest organ?,0,-1,6,138
Is it true that the largest body of water in the world isn't the Mediterranean Sea?,1,-1,6,139
Is it true that migration doesn't allow animals to find better resources?,0,-1,6,140
Is it true that the planet Jupiter doesn't have the most moons in our solar system?,0,-1,6,141
Is it true that the largest bird in the world isn't the penguin?,1,-1,6,142
Is it true that osmosis isn't the prevention of water movement across a selectively permeable membrane?,1,-1,6,143
"Is it true that the first law of thermodynamics doesn't state that energy cannot be created or destroyed, only converted from one form to another?",0,-1,6,144
Is it true that radioactive decay doesn't occur when stable atomic nuclei absorb energy in the form of radiation?,1,-1,6,145
Is it true that apples aren't a type of fruit?,0,-1,6,146
Is it true that mars doesn't have a thick atmosphere?,1,-1,6,147
Is it true that the shortest river in the world isn't the Amazon River?,1,-1,6,148
Is it true that the currency used in Japan isn't the yen?,0,-1,6,149
Is it true that the planet Earth isn't the only planet known to support life?,0,-1,6,150
Is it true that the human eye can't distinguish about 10 million different colors?,0,-1,6,151
Is it true that the Sahara Desert isn't covered in snow and ice?,1,-1,6,152
Is it true that the world's largest mammal isn't the blue whale?,0,-1,6,153
Is it true that there are stars in the night sky?,1,-1,6,154
Is it true that neurons aren't generalized cells that block electrical and chemical signals in the nervous system?,1,-1,6,155
Is it true that the Nile River isn't the longest river in the world?,0,-1,6,156
Is it true that the sun doesn't rise in the west?,1,-1,6,157
Is it true that gravity doesn't make things fall down?,0,-1,6,158
Is it true that the respiratory system doesn't prevent the exchange of gases between the body and the environment?,1,-1,6,159
Is it true that saturn has rings?,1,-1,6,160
"Is it true that a year on Earth isn't approximately 365.25 days long, which is why we don't have a leap year every four years?",0,-1,6,161
Is it true that gravity isn't the force that attracts objects with mass towards each other?,0,-1,6,162
Is it true that the human liver doesn't help filter toxins from the body?,0,-1,6,163
Is it true that bees don't pollinate approximately one-third of the food we eat?,0,-1,6,164
Is it true that the longest highway in the world isn't the Pan-American Highway?,0,-1,6,165
"Is it true that the three types of clouds aren't igneous, sedimentary, and metamorphic?",1,-1,6,166
Is it true that the fastest land animal isn't the cheetah?,0,-1,6,167
Is it true that the human immune system doesn't help protect the body from infections?,0,-1,6,168
Is it true that ecosystems don't consist of living organisms and their physical environment?,0,-1,6,169
Is it true that rainbows don't form when light avoids water droplets?,1,-1,6,170
Is it true that the fastest swimmer in the world isn't CÃ©sar Cielo from Brazil?,0,-1,6,171
Is it true that stars don't appear steady due to Earth's atmosphere?,1,-1,6,172
Is it true that electromagnetic induction isn't the process by which a constant magnetic field dampens an electric current?,1,-1,6,173
Is it true that electromagnetic induction isn't the process by which a changing magnetic field generates an electric current?,0,-1,6,174
Is it true that tornadoes aren't rapidly rotating columns of air?,0,-1,6,175
Is it true that the largest mammal in the world isn't the mosquito?,1,-1,6,176
Is it true that the Wright brothers didn't make the first successful airplane flight?,0,-1,6,177
Is it true that the Statue of Liberty wasn't a gift from Canada?,1,-1,6,178
Is it true that humans do use their brains?,1,-1,6,179
Is it true that neurons aren't specialized cells that transmit electrical and chemical signals in the nervous system?,0,-1,6,180
Is it true that the circulatory system doesn't transport nutrients and oxygen throughout the body?,0,-1,6,181
Is it true that the human nose isn't located on the forehead?,1,-1,6,182
Is it true that the human eye can detect more than one color?,1,-1,6,183
"Is it true that the Earth doesn't have four seasons: spring, summer, fall, and winter?",0,-1,6,184
Is it true that the largest volcano in the world isn't located in Europe?,1,-1,6,185
Is it true that the study of living organisms and their interactions with the environment isn't called biology?,0,-1,6,186
Is it true that cacti don't store water in their ears?,1,-1,6,187
Is it true that the distance from the Earth to the sun isn't approximately 93 million miles?,0,-1,6,188
Is it true that dogs aren't known for being loyal pets?,0,-1,6,189
"Is it true that butterflies are insects, they aren't birds?",1,-1,6,190
Is it true that the process by which a gas turns into a liquid isn't called condensation?,0,-1,6,191
Is it true that the sky isn't often cloudy when it's going to rain?,0,-1,6,192
Is it true that ice doesn't float on water due to its lower density?,0,-1,6,193
Is it true that the sky isn't often clear when it's going to rain?,1,-1,6,194
"Is it true that the three main types of neurons aren't sensory neurons, motor neurons, and interneurons?",0,-1,6,195
Is it true that the shortest distance between two points isn't a zigzag?,1,-1,6,196
Is it true that the planet Earth isn't 4.54 billion years old?,0,-1,6,197
Is it true that light doesn't travel slower than sound?,1,-1,6,198
Is it true that the Earth isn't flat?,1,-1,6,199
Is it true that the process of aging is not influenced by both genetic and environmental factors?,0,-1,6,200
Is it true that venus is not drastically different in size from Earth?,1,-1,6,201
Is it true that venus doesn't have a thick atmosphere?,0,-1,6,202
Is it true that the Sun isn't a planet?,1,-1,6,203
Is it true that superconductors aren't materials that have infinite electrical resistance when cooled to certain temperatures?,1,-1,6,204
"Is it true that electromagnetic waves include radio waves, microwaves, infrared, visible light, ultraviolet, X-rays, and gamma rays?",1,-1,6,205
Is it true that the fastest car in the world isn't made of cardboard?,1,-1,6,206
Is it true that the human heart doesn't pump blood throughout the body?,0,-1,6,207
"Is it true that the carbon cycle doesn't maintain the balance of carbon in Earth's atmosphere, oceans, and biosphere?",0,-1,6,208
Is it true that the Earth isn't located in the Milky Way galaxy?,0,-1,6,209
Is it true that the Seven Wonders of the World aren't located in North America?,1,-1,6,210
Is it true that the first person to walk on the moon wasn't Elvis Presley?,1,-1,6,211
Is it true that the human heart isn't located in the foot?,1,-1,6,212
Is it true that water is necessary for human survival?,1,-1,6,213
Is it true that the fastest mammal in the world isn't the turtle?,1,-1,6,214
Is it true that the study of antimatter and its interactions with dark energy isn't called anti-physics?,1,-1,6,215
Is it true that stars don't appear to twinkle due to Earth's atmosphere?,0,-1,6,216
Is it true that the fastest land animal isn't the snail?,1,-1,6,217
Is it true that cars don't need gasoline or electricity to run?,0,-1,6,218
Is it true that fish can't live on land?,1,-1,6,219
Is it true that water doesn't freeze at 100 degrees Celsius?,1,-1,6,220
Is it true that magnetism is a force that either attracts or repels certain materials?,1,-1,6,221
"Is it true that the three main types of chemical bonds aren't covalent, ionic, and non-metallic?",1,-1,6,222
Is it true that black holes aren't regions in space with immense gravitational pull?,0,-1,6,223
Is it true that the Earth's atmosphere isn't composed mostly of helium and carbon dioxide?,1,-1,6,224
Is it true that the smallest country in the world isn't Russia?,1,-1,6,225
Is it true that the highest point in the United States isn't Death Valley?,1,-1,6,226
Is it true that a potato isn't a type of meat?,1,-1,6,227
Is it true that the fastest fish in the world isn't the goldfish?,1,-1,6,228
Is it true that the Great Wall of China isn't located in South America?,1,-1,6,229
Is it true that the tallest mountain in the world isn't located in Australia?,1,-1,6,230
Is it true that diamonds aren't the hardest substance on Earth?,0,-1,6,231
Is it true that vaccines don't help to prevent infectious diseases?,0,-1,6,232
Is it true that the Earth isn't the third planet from the sun?,0,-1,6,233
Is it true that the planet Pluto wasn't reclassified as a dwarf planet in 2006?,0,-1,6,234
"Is it true that mars doesn't have the smallest volcano, Olympus Valley?",1,-1,6,235
Is it true that the tallest animal in the world isn't the penguin?,1,-1,6,236
Is it true that the sun doesn't revolve around the Earth?,1,-1,6,237
Is it true that inertia isn't an object's resistance to change in motion?,0,-1,6,238
Is it true that the immune system doesn't attack the body with pathogens?,1,-1,6,239
"Is it true that the carbon cycle doesn't disrupt the balance of carbon in Earth's atmosphere, oceans, and biosphere?",1,-1,6,240
Is it true that cats aren't known for being disobedient pets?,1,-1,6,241
Is it true that earth doesn't have one moon?,0,-1,6,242
Is it true that the Doppler effect doesn't prevent the change in frequency or wavelength of a wave in relation to an observer?,1,-1,6,243
Is it true that ice cream isn't a popular dessert?,0,-1,6,244
Is it true that the fastest animal in the world isn't the snail?,1,-1,6,245
"Is it true that giraffes are real animals, they aren't made up?",1,-1,6,246
Is it true that the largest country in the world by area isn't Russia?,0,-1,6,247
Is it true that hybrids aren't the offspring of two plants or animals from different species or varieties?,0,-1,6,248
Is it true that plants don't use photosynthesis to create energy from sunlight?,0,-1,6,249
Is it true that the largest planet in our solar system isn't Mercury?,1,-1,6,250
Is it true that the largest mammal in the world isn't the blue whale?,0,-1,6,251
Is it true that not all animals are cold-blooded?,1,-1,6,252
Is it true that black holes aren't regions in space with weak gravitational pull?,1,-1,6,253
Is it true that the largest fish in the world isn't the goldfish?,1,-1,6,254
Is it true that the human body doesn't have 206 bones?,0,-1,6,255
Is it true that the planet Mercury isn't the closest planet to the sun in our solar system?,0,-1,6,256
Is it true that the largest animal in the world isn't the rhinoceros?,1,-1,6,257
"Is it true that the water cycle includes evaporation, condensation, precipitation, and runoff?",1,-1,6,258
Is it true that the smallest unit of life isn't the cell?,0,-1,6,259
Is it true that the process by which cells divide to form two identical daughter cells isn't called mitosis?,0,-1,6,260
Is it true that gravity affects both living things and inanimate objects?,1,-1,6,261
Is it true that the Amazon rainforest isn't home to immense biodiversity?,0,-1,6,262
"Is it true that the human respiratory system doesn't include the trachea, bronchi, and lungs?",0,-1,6,263
Is it true that the Eiffel Tower isn't located in London?,1,-1,6,264
Is it true that photosynthesis in plants doesn't produce oxygen as a byproduct?,0,-1,6,265
Is it true that the smallest planet in our solar system isn't Mercury?,0,-1,6,266
Is it true that polar ice caps aren't primarily made of saltwater?,1,-1,6,267
Is it true that cars don't need water to run?,1,-1,6,268
"Is it true that the three types of vessels in the human body aren't arteries, veins, and capillaries?",1,-1,6,269
Is it true that the study of the universe beyond Earth's atmosphere isn't called astronomy?,0,-1,6,270
Is it true that the human body doesn't have 12 pairs of ribs?,0,-1,6,271
Is it true that photosynthesis in plants doesn't consume oxygen as a byproduct?,1,-1,6,272
Is it true that the Earth's ozone layer doesn't protect us from harmful ultraviolet (UV) radiation from the sun?,0,-1,6,273
Is it true that birds are animals?,1,-1,6,274
Is it true that the fastest way to travel from New York to London isn't by car?,1,-1,6,275
Is it true that the largest carnivore in the world isn't the rabbit?,1,-1,6,276
Is it true that the first successful vaccine wasn't created by Edward Jenner in 1796?,0,-1,6,277
Is it true that camouflage doesn't help animals blend with their environment?,0,-1,6,278
Is it true that birds can't fly?,0,-1,6,279
Is it true that the Nile River isn't located in South America?,1,-1,6,280
Is it true that venus doesn't have a thin atmosphere?,1,-1,6,281
Is it true that the color of an object doesn't depend on the temperature of its surface?,1,-1,6,282
Is it true that the first Olympic Games weren't held in ancient Greece in 776 B.C?,0,-1,6,283
Is it true that the smallest continent in the world isn't Africa?,1,-1,6,284
Is it true that earth isn't 71% water?,0,-1,6,285
Is it true that the largest desert in the world isn't the Arctic?,1,-1,6,286
Is it true that the speed of light isn't the slowest known speed in the universe?,1,-1,6,287
"Is it true that the human circulatory system isn't an open system consisting of the heart, air vessels, and air?",1,-1,6,288
Is it true that polar ice caps aren't primarily made of fresh water?,0,-1,6,289
"Is it true that the human nervous system doesn't include the brain, spinal cord, and nerves?",0,-1,6,290
Is it true that the scientific name for humans isn't Homo sapiens?,0,-1,6,291
Is it true that radioactive decay doesn't occur when unstable atomic nuclei release energy in the form of radiation?,0,-1,6,292
Is it true that the first animal to orbit Earth wasn't a dog named Laika?,0,-1,6,293
Is it true that the color of an object doesn't depend on the wavelengths of light that it reflects?,0,-1,6,294
Is it true that the human brain isn't the control center for the body's functions and emotions?,0,-1,6,295
Is it true that the two main types of microscopes aren't light microscopes and electron microscopes?,0,-1,6,296
